{
  "$schema": "https://json-schema.org/draft/2020-12/schema",
  "$id": "https://agentlens.dev/schemas/agentlens.event.v2.json",
  "$comment": "Waygent trust console event envelope. Legacy KWS namespaces are intentionally unsupported.",
  "title": "agentlens.event.v2",
  "type": "object",
  "additionalProperties": false,
  "required": [
    "schema",
    "event_id",
    "run_id",
    "event_type",
    "producer",
    "occurred_at",
    "sequence",
    "phase",
    "outcome",
    "severity",
    "trust_impact",
    "summary",
    "payload"
  ],
  "properties": {
    "schema": {"type": "string", "const": "agentlens.event.v2"},
    "event_id": {"type": "string", "pattern": "^evt_[A-Za-z0-9_-]{6,64}$"},
    "run_id": {"type": "string", "minLength": 1},
    "event_type": {"type": "string", "pattern": "^(platform|runway|kernel|lens)\\.[a-z][a-z0-9_]*(\\.[a-z][a-z0-9_]*)?$"},
    "producer": {
      "type": "object",
      "additionalProperties": false,
      "required": ["name", "version"],
      "properties": {
        "name": {"type": "string", "const": "waygent"},
        "version": {"type": "string"}
      }
    },
    "occurred_at": {"type": "string", "pattern": "^\\d{4}-\\d{2}-\\d{2}T\\d{2}:\\d{2}:\\d{2}(\\.\\d+)?Z$"},
    "sequence": {"type": "integer", "minimum": 0},
    "phase": {
      "type": "string",
      "enum": ["run", "contract", "worker", "review", "verification", "retry", "quality", "merge", "resume", "apply", "finish"]
    },
    "outcome": {"type": "string", "enum": ["success", "failed", "blocked", "partial", "unknown"]},
    "severity": {"type": "string", "enum": ["debug", "info", "warn", "error", "critical"]},
    "task_id": {"type": "string"},
    "attempt_id": {"type": "string"},
    "candidate_id": {"type": "string"},
    "gate_id": {"type": "string"},
    "evidence_refs": {"type": "array", "items": {"type": "string"}},
    "artifact_refs": {"type": "array", "items": {"type": "string"}},
    "projection_hints": {"type": "object"},
    "trust_impact": {
      "type": "string",
      "enum": ["supports_success", "supports_failure", "requires_attention", "neutral", "downgrades_trust"]
    },
    "summary": {"type": "string", "minLength": 1, "maxLength": 1200},
    "payload": {"type": "object"}
  }
}
